{
  "$schema": "../schemas/docs-links.schema.json",
  "sourceId": "kalshi-llms",
  "url": "https://docs.kalshi.com/llms.txt",
  "sha256": "96744d72a42f2c07cb6729c5e5516f759ecd669f34950220bfc97bf59a6eaee0",
  "linkCount": 245,
  "links": [
    {
      "title": "Introduction",
      "url": "https://docs.kalshi.com/welcome/index.md",
      "description": "Welcome to the Kalshi API documentation"
    },
    {
      "title": "API Environments and Endpoints",
      "url": "https://docs.kalshi.com/getting_started/api_environments.md",
      "description": "REST and WebSocket base URLs for production and demo"
    },
    {
      "title": "Quick Start: Market Data",
      "url": "https://docs.kalshi.com/getting_started/quick_start_market_data.md",
      "description": "Learn how to access real-time market data without authentication"
    },
    {
      "title": "Quick Start: Authenticated Requests",
      "url": "https://docs.kalshi.com/getting_started/quick_start_authenticated_requests.md",
      "description": "Three simple steps to make your first authenticated API request to Kalshi"
    },
    {
      "title": "Quick Start: Create your first order",
      "url": "https://docs.kalshi.com/getting_started/quick_start_create_order.md",
      "description": "Learn how to find markets, place orders, check status, and cancel orders on Kalshi"
    },
    {
      "title": "Quick Start: WebSockets",
      "url": "https://docs.kalshi.com/getting_started/quick_start_websockets.md",
      "description": "Learn how to establish and maintain a WebSocket connection to stream real-time market data"
    },
    {
      "title": "Kalshi SDKs",
      "url": "https://docs.kalshi.com/sdks/overview.md",
      "description": "Official Python and TypeScript SDKs for the Kalshi API"
    },
    {
      "title": "Making Your First Request",
      "url": "https://docs.kalshi.com/getting_started/making_your_first_request.md",
      "description": "Start trading with Kalshi API in under 5 minutes"
    },
    {
      "title": "Test In The Demo Environment",
      "url": "https://docs.kalshi.com/getting_started/demo_env.md",
      "description": "Set up and test with Kalshi's demo environment"
    },
    {
      "title": "API Keys",
      "url": "https://docs.kalshi.com/getting_started/api_keys.md",
      "description": "API Key usage"
    },
    {
      "title": "Rate Limits and Tiers",
      "url": "https://docs.kalshi.com/getting_started/rate_limits.md",
      "description": "Token costs, tier budgets, and burst capacity for the Kalshi API"
    },
    {
      "title": "Understanding Pagination",
      "url": "https://docs.kalshi.com/getting_started/pagination.md",
      "description": "Learn how to navigate through large datasets using cursor-based pagination"
    },
    {
      "title": "Orderbook Responses",
      "url": "https://docs.kalshi.com/getting_started/orderbook_responses.md",
      "description": "Understanding Kalshi orderbook structure and binary prediction market mechanics"
    },
    {
      "title": "Order direction (outcome_side and book_side)",
      "url": "https://docs.kalshi.com/getting_started/order_direction.md",
      "description": "How direction is expressed on Order, Fill, and Trade responses, and how to migrate from the legacy action/side fields."
    },
    {
      "title": "Order Groups",
      "url": "https://docs.kalshi.com/getting_started/order_groups.md",
      "description": "Automatic order cancellation based on rolling contract limits"
    },
    {
      "title": "Subaccounts",
      "url": "https://docs.kalshi.com/getting_started/subaccounts.md",
      "description": "Isolate balances and positions within a single Direct account"
    },
    {
      "title": "Sub-users vs. Subaccounts",
      "url": "https://docs.kalshi.com/getting_started/sub_users_vs_subaccounts.md",
      "description": "Sub-users add people to an account; subaccounts split its funds"
    },
    {
      "title": "Fixed-Point Representation",
      "url": "https://docs.kalshi.com/getting_started/fixed_point_migration.md",
      "description": "Fixed-point prices, price level structures, and fractional contract quantities."
    },
    {
      "title": "Fee Rounding",
      "url": "https://docs.kalshi.com/getting_started/fee_rounding.md",
      "description": "How trade fees and balances are rounded."
    },
    {
      "title": "Historical Data",
      "url": "https://docs.kalshi.com/getting_started/historical_data.md",
      "description": "Accessing historical exchange data via the Kalshi API."
    },
    {
      "title": "Targets & Milestones",
      "url": "https://docs.kalshi.com/getting_started/targets_and_milestones.md",
      "description": "Using milestones and structured targets in the Trade API"
    },
    {
      "title": "Market Lifecycle",
      "url": "https://docs.kalshi.com/getting_started/market_lifecycle.md",
      "description": "How markets move from creation to settlement"
    },
    {
      "title": "Maintenance and Pauses",
      "url": "https://docs.kalshi.com/getting_started/maintenance_and_pauses.md",
      "description": "Scheduled maintenance windows, trading pauses, and exchange pauses"
    },
    {
      "title": "Market Settlement",
      "url": "https://docs.kalshi.com/getting_started/market_settlement.md",
      "description": "How market outcomes are determined and positions are resolved"
    },
    {
      "title": "Settlement Bounds",
      "url": "https://docs.kalshi.com/getting_started/settlement_bounds.md",
      "description": "Settlement bounds trading and payout mechanics"
    },
    {
      "title": "Request for Quote (RFQ)",
      "url": "https://docs.kalshi.com/getting_started/rfqs.md",
      "description": "How the Kalshi RFQ system works"
    },
    {
      "title": "Exchange Sharding",
      "url": "https://docs.kalshi.com/getting_started/exchange_sharding.md",
      "description": "Exchange sharding in the Predictions API"
    },
    {
      "title": "Kalshi Glossary",
      "url": "https://docs.kalshi.com/getting_started/terms.md",
      "description": "Core terminology used in the Kalshi exchange"
    },
    {
      "title": "CF Benchmarks REST Passthrough",
      "url": "https://docs.kalshi.com/cfbenchmarks/rest-passthrough.md",
      "description": "Query CF Benchmarks REST data using your existing Kalshi API credentials"
    },
    {
      "title": "Get Exchange Status",
      "url": "https://docs.kalshi.com/api-reference/exchange/get-exchange-status.md",
      "description": "Endpoint for getting the exchange status."
    },
    {
      "title": "Get Series Fee Changes",
      "url": "https://docs.kalshi.com/api-reference/exchange/get-series-fee-changes.md"
    },
    {
      "title": "Get Exchange Schedule",
      "url": "https://docs.kalshi.com/api-reference/exchange/get-exchange-schedule.md",
      "description": "Endpoint for getting the exchange schedule."
    },
    {
      "title": "Get User Data Timestamp",
      "url": "https://docs.kalshi.com/api-reference/exchange/get-user-data-timestamp.md",
      "description": "There is typically a short delay before exchange events are reflected in the API endpoints. Whenever possible, combine API responses to PUT/POST/DELETE requests with WebSocket data to obtain the most accurate view of the exchange state. This endpoint provides an approximate indication of when the da…"
    },
    {
      "title": "Get Market Candlesticks",
      "url": "https://docs.kalshi.com/api-reference/market/get-market-candlesticks.md",
      "description": "Time period length of each candlestick in minutes. Valid values: 1 (1 minute), 60 (1 hour), 1440 (1 day). Candlesticks for markets that settled before the historical cutoff are only available via `GET /historical/markets/{ticker}/candlesticks`. See [Historical Data](https://docs.kalshi.com/getting_s…"
    },
    {
      "title": "Get Trades",
      "url": "https://docs.kalshi.com/api-reference/market/get-trades.md",
      "description": "Endpoint for getting all trades for all markets. A trade represents a completed transaction between two users on a specific market. Each trade includes the market ticker, price, quantity, and timestamp information. Block trades are included in the response by default and identified by the `is_block_…"
    },
    {
      "title": "Get Market Orderbook",
      "url": "https://docs.kalshi.com/api-reference/market/get-market-orderbook.md",
      "description": "Endpoint for getting the current order book for a specific market.  The order book shows all active bid orders for both yes and no sides of a binary market. It returns yes bids and no bids only (no asks are returned). This is because in binary markets, a bid for yes at price X is equivalent to an as…"
    },
    {
      "title": "Get Multiple Market Orderbooks",
      "url": "https://docs.kalshi.com/api-reference/market/get-multiple-market-orderbooks.md",
      "description": "Endpoint for getting the current order books for multiple markets in a single request. The order book shows all active bid orders for both yes and no sides of a binary market. It returns yes bids and no bids only (no asks are returned). This is because in binary markets, a bid for yes at price X is…"
    },
    {
      "title": "Get Series",
      "url": "https://docs.kalshi.com/api-reference/market/get-series.md",
      "description": "Endpoint for getting data about a specific series by its ticker.  A series represents a template for recurring events that follow the same format and rules (e.g., \"Monthly Jobs Report\", \"Weekly Initial Jobless Claims\", \"Daily Weather in NYC\"). Series define the structure, settlement sources, and met…"
    },
    {
      "title": "Get Series List",
      "url": "https://docs.kalshi.com/api-reference/market/get-series-list.md",